10 states righteous man regardeth,1.0
11 cannot mean anything because,1.0
18 specific areas in which,1.0
99 of russia is now,1.0
about it instead of cake,1.0
acceptance of metaphysical space that,1.0
accidents do you support keeping,1.0
act and this is how,1.0
actions lean more to pain,1.0
additionally there are other cases,1.0
affirmed http www reasonablefaith org,1.0
ago people spoke in metaphors,1.0
all happen to them on,1.0
amount of guns per capita,1.0
and child behavior the general,1.0
and disgraceful however men would,1.0
and half after jesus ascended,1.0
and low energy sediment based,1.0
and publican 18 verily say,1.0
and the hebrew day it,1.0
and the intentions of creating,1.0
and this should be known,1.0
any religion my opponent pro,1.0
argument is simple it is,1.0
arguments contention the attack rests,1.0
arms to china it is,1.0
around with your ambiguous claims,1.0
as the playstation and xbox,1.0
as the taas so this,1.0
assume he will be sent,1.0
at younger age will go,1.0
at younger age will now,1.0
available for free yet you,1.0
bad idea for the following,1.0
bad we should celebrate his,1.0
ban on alcohol or any,1.0
bbc com what is the,1.0
be considered an injustice inaction,1.0
be fired through my debate,1.0
be reproduction without sperm of,1.0
be unintentional deaths in war,1.0
be used it makes much,1.0
be very fast if you,1.0
because he went through the,1.0
behind signature behind that can,1.0
being by another murder and,1.0
being positive correlation thus one,1.0
believe that everyone is important,1.0
believe the song is about,1.0
believe the sound is much,1.0
beneficial to society which have,1.0
best imprecise debating resolutions on,1.0
better than the pleasures of,1.0
biased media reporters that almost,1.0
biology demands erroneous results ignoring,1.0
bulbs and manage the mercury,1.0
burden do not have to,1.0
but they do not exist,1.0
but with independence it would,1.0
by historian writing about person,1.0
by the nuclear weapons archive,1.0
call this goodall in this,1.0
can already take place without,1.0
can and does exist both,1.0
can go first if you,1.0
can tell me the tsa,1.0
can we go thrift shopping,1.0
championship because nobody likes rape,1.0
character god did not create,1.0
city of jerusalem should give,1.0
clean the public toilets use,1.0
cns miis edu the looming,1.0
coal however the mining of,1.0
colombia for long time and,1.0
committed in guatemala by chiquita,1.0
conclusion we see that economic,1.0
conditional and the condition was,1.0
copyrighted data that the content,1.0
could think he was rather,1.0
couple and try to help,1.0
dance and provencal song and,1.0
darwin saw clearly the empathic,1.0
debate itself will leave it,1.0
debate over the particulars fifth,1.0
debate rather than the web,1.0
derived from pure will thought,1.0
does say almost irrefutably and,1.0
double standards there is no,1.0
draft was not violating the,1.0
economics has very precise meaning,1.0
ed 543 1925 probable cause,1.0
elaborate from there this is,1.0
ended up regretting this and,1.0
essentially gave us the technology,1.0
evaluate my actions to draw,1.0
even if he does recognize,1.0
every tonne of carbon emitted,1.0
except for asexual organisms s2,1.0
exist within space and time,1.0
extent that we believe in,1.0
